[
  {
    "id": "nl-bre-psy-001",
    "name": "Praktijk Mentaal Welbevinden",
    "type": "psychologist",
    "address": { "street": "Hoofdstraat 123", "postcode": "4811AA", "city": "Breda" },
    "contract": { "status": "contracted" },
    "waiting_time_weeks": 2,
    "specializations": ["stress", "burnout"],
    "languages": ["NL", "EN"],
    "digital_options": ["online_intake"],
    "rating": { "score": 8.6, "count": 124 },
    "updated_at": "2025-09-18"
  },
  {
    "id": "nl-ein-ggz-002",
    "name": "GGZ Eindhoven Centrum",
    "type": "ggz",
    "address": { "street": "Stationslaan 3", "postcode": "5611AA", "city": "Eindhoven" },
    "contract": { "status": "cap_reached", "note": "Nieuw contract in aanvraag" },
    "waiting_time_weeks": 6,
    "specializations": ["depression", "anxiety"],
    "languages": ["NL"],
    "digital_options": [],
    "rating": { "score": 7.9, "count": 58 },
    "updated_at": "2025-09-19"
  },
  {
      "id": "nl-utr-psy-003",
      "name": "Praktijk Balance Utrecht",
      "type": "psychologist",
      "address": { "street": "Lange Nieuwstraat 45", "postcode": "3512PH", "city": "Utrecht" },
      "contract": { "status": "contracted" },
      "waiting_time_weeks": 3,
      "specializations": ["anxiety", "depression"],
      "languages": ["NL", "EN"],
      "digital_options": ["online_intake", "chat_nurse"],
      "rating": { "score": 8.2, "count": 98 },
      "updated_at": "2025-09-18"
    },
    {
      "id": "nl-ams-ggz-004",
      "name": "GGZ Centrum Amsterdam Zuid",
      "type": "ggz",
      "address": { "street": "Beethovenstraat 220", "postcode": "1077JZ", "city": "Amsterdam" },
      "contract": { "status": "contracted" },
      "waiting_time_weeks": 1,
      "specializations": ["burnout", "stress", "work_pressure"],
      "languages": ["NL", "EN", "PL"],
      "digital_options": ["online_intake"],
      "rating": { "score": 9.0, "count": 187 },
      "updated_at": "2025-09-19"
    },
    {
      "id": "nl-rot-psy-005",
      "name": "MindWell Rotterdam",
      "type": "psychologist",
      "address": { "street": "Westblaak 88", "postcode": "3012KM", "city": "Rotterdam" },
      "contract": { "status": "cap_reached", "note": "Limited reimbursement after 8 sessions" },
      "waiting_time_weeks": 5,
      "specializations": ["depression", "trauma", "relationship_issues"],
      "languages": ["NL", "EN", "TR"],
      "digital_options": [],
      "rating": { "score": 7.8, "count": 73 },
      "updated_at": "2025-09-20"
    },
    {
      "id": "nl-hag-ggz-006",
      "name": "Stadspoli Den Haag GGZ",
      "type": "ggz",
      "address": { "street": "Zuidwal 32", "postcode": "2512XP", "city": "Den Haag" },
      "contract": { "status": "not_contracted" },
      "waiting_time_weeks": 7,
      "specializations": ["anxiety", "addiction"],
      "languages": ["NL", "AR"],
      "digital_options": ["online_intake"],
      "rating": { "score": 7.3, "count": 42 },
      "updated_at": "2025-09-21"
    },
    {
      "id": "nl-tlb-psy-007",
      "name": "Psychologenpraktijk Tilburg Noord",
      "type": "psychologist",
      "address": { "street": "Besterdring 190", "postcode": "5014HN", "city": "Tilburg" },
      "contract": { "status": "contracted" },
      "waiting_time_weeks": 4,
      "specializations": ["stress", "burnout", "work_life_balance"],
      "languages": ["NL", "EN"],
      "digital_options": ["chat_nurse"],
      "rating": { "score": 8.4, "count": 115 },
      "updated_at": "2025-09-22"
    },
    {
      "id": "nl-grn-ggz-008",
      "name": "Noorderlicht GGZ Groningen",
      "type": "ggz",
      "address": { "street": "Oude Ebbingestraat 23", "postcode": "9712HA", "city": "Groningen" },
      "contract": { "status": "contracted" },
      "waiting_time_weeks": 2,
      "specializations": ["depression", "trauma", "youth_care"],
      "languages": ["NL", "EN"],
      "digital_options": ["online_intake", "chat_nurse"],
      "rating": { "score": 8.9, "count": 209 },
      "updated_at": "2025-09-23"
    },
    {
      "id": "nl-nij-psy-009",
      "name": "Therapiecentrum Nijmegen Oost",
      "type": "psychologist",
      "address": { "street": "Berg en Dalseweg 64", "postcode": "6521JD", "city": "Nijmegen" },
      "contract": { "status": "not_contracted" },
      "waiting_time_weeks": 6,
      "specializations": ["depression", "anxiety", "burnout"],
      "languages": ["NL", "EN", "PL"],
      "digital_options": [],
      "rating": { "score": 7.5, "count": 58 },
      "updated_at": "2025-09-24"
    },
    {
      "id": "nl-lei-psy-010",
      "name": "Leiden Mindcare",
      "type": "psychologist",
      "address": { "street": "Breestraat 18", "postcode": "2311CJ", "city": "Leiden" },
      "contract": { "status": "contracted" },
      "waiting_time_weeks": 3,
      "specializations": ["stress", "anxiety", "sleep_problems"],
      "languages": ["NL", "EN", "TR"],
      "digital_options": ["online_intake"],
      "rating": { "score": 8.8, "count": 132 },
      "updated_at": "2025-09-25"
    }
]
